{"evaluation_profile":null,"execution_mode":"development","idempotency_key":"run-c4185f0e1a5f","limits":{"max_discovery_items":50,"max_file_count":250000,"max_issue_body_bytes":200000,"max_repo_bytes":2147483648,"max_tasks":1,"repo_acquire_timeout_seconds":300},"metadata":{},"repository":{"expected_tree_sha256":null,"kind":"local_git","locator":"/Users/aniketpathak/Desktop/DobbyAI","revision":null},"runtime_profile":"local-default","schema_version":"1.0","task":{"issue_snapshot_id":null,"issue_url":null,"repository_query":null,"text":"Test JSON pipeline"},"task_mode":"single_issue"}